{
  "schema_version": 1,
  "request_id": "req_council_ready_001",
  "command": "council.ready",
  "params": {
    "session_id": "sess_conformance_council",
    "actor": "agent-1",
    "command_id": "cmd_council_ready_conformance",
    "payload": {
      "summary": "Found relevant protocol and fixture constraints.",
      "notes_ref": "notes/static-agent-1.md"
    }
  }
}
