{
  "schema_version": 1,
  "request_id": "req_council_speak_argument_graph_001",
  "command": "council.speak",
  "params": {
    "session_id": "sess_conformance_council",
    "actor": "agent-1",
    "command_id": "cmd_council_speak_argument_graph_multi_link",
    "payload": {
      "turn": 3,
      "speech": "I support static fixtures as the handoff, but challenge treating fixture publication as proof that runtime validation exists.",
      "claims": [
        {
          "claim_id": "T03.C1",
          "summary": "Fixture publication is not runtime validation evidence.",
          "kind": "risk"
        }
      ],
      "stance_links": [
        {
          "target_event_id": "evt_argument_graph_support_prior_council",
          "target_claim_id": "T02.C1",
          "stance": "support",
          "rationale": "The fixture-first sequence is the right implementation order."
        },
        {
          "target_event_id": "evt_argument_graph_opening_new_axis_council",
          "target_claim_id": "T01.C1",
          "stance": "challenge",
          "rationale": "Traceability still needs later daemon enforcement before any runtime-readiness claim."
        }
      ],
      "contribution_type": "challenge",
      "evidence": []
    }
  }
}
