{
  "schema_version": 1,
  "request_id": "req_council_prepared_partial_001",
  "command": "council.prepared_partial",
  "params": {
    "session_id": "sess_conformance_council",
    "actor": "agent-2",
    "command_id": "cmd_council_prepared_partial_conformance",
    "payload": {
      "reason": "timeout",
      "summary": "Partial notes are available.",
      "notes_ref": "notes/static-agent-2.md"
    }
  }
}
