{
  "schema_version": 1,
  "request_id": "req_council_hand_raise_001",
  "command": "council.hand_raise",
  "params": {
    "session_id": "sess_conformance_council",
    "actor": "agent-1",
    "command_id": "cmd_council_hand_raise_conformance",
    "payload": {
      "turn": 1,
      "intent": "support",
      "relevance": 5,
      "urgency": 3,
      "reason": "The static handoff is complete."
    }
  }
}
