{
  "schema_version": 1,
  "request_id": "req_stream_follow_001",
  "command": "stream.replay",
  "params": {
    "session_id": "sess_conformance_delegation",
    "member": "agent-1",
    "since": "cur_000000000000_evt_created_001",
    "follow": true,
    "follow_timeout_ms": 500,
    "follow_poll_ms": 25
  }
}
