{
  "schema_version": 1,
  "request_id": "req_council_grant_001",
  "command": "council.grant",
  "params": {
    "session_id": "sess_conformance_council",
    "actor": "agent-mod",
    "command_id": "cmd_council_grant_conformance",
    "payload": {
      "turn": 1,
      "member": "agent-1",
      "selection_mode": "moderator_direct"
    }
  }
}
