{
  "schema_version": 1,
  "request_id": "req_council_intervene_001",
  "command": "council.intervene",
  "params": {
    "session_id": "sess_conformance_council",
    "actor": "agent-mod",
    "command_id": "cmd_council_intervene_conformance",
    "payload": {
      "member": "agent-1",
      "reason": "scope_guard",
      "message": "Stay scoped to static COUNC fixture evidence."
    }
  }
}
