{
  "schema_version": 1,
  "request_id": "req_council_request_vote_001",
  "command": "council.request_vote",
  "params": {
    "session_id": "sess_conformance_council",
    "actor": "agent-mod",
    "command_id": "cmd_council_request_vote_conformance",
    "payload": {
      "draft_version": 1,
      "timeout_sec": 600
    }
  }
}
