{
  "schema_version": 1,
  "request_id": "req_council_lock_agenda_001",
  "command": "council.lock_agenda",
  "params": {
    "session_id": "sess_conformance_council",
    "actor": "agent-mod",
    "command_id": "cmd_council_lock_agenda_conformance",
    "payload": {
      "decision_question": "Should the static council contract ship?",
      "max_rounds": 2
    }
  }
}
