{
  "schema_version": 1,
  "request_id": "req_council_propose_001",
  "command": "council.propose",
  "params": {
    "session_id": "sess_conformance_council",
    "actor": "agent-mod",
    "command_id": "cmd_council_propose_conformance",
    "payload": {
      "draft": "Ship the static COUNC conformance fixture set."
    }
  }
}
